<iati-activities version="1.01" generated-datetime="2012-03-31T11:03:06Z"><ir:registry-record xml:lang="en" file-id="GB-1" source-url="http://projects.dfid.gov.uk/iati/NonIATI/AC" publisher-id="GB-1" publisher-role="Funding" contact-email="ppisupport@dfid.gov.uk" donor-id="GB-1" donor-type="10" title="DFID Activity File" activity-period="All Periods" last-updated-datetime="2012-03-31T11:03:06Z" generated-datetime="2012-03-31T11:03:06Z" verification-status="1" format="xml" license="IATI" xmlns:ir="http://iatiregistry.org/ns/record#"/><iati-activity xml:lang="en" default-currency="GBP" hierarchy="1"><reporting-org ref="GB-1" type="10">Department for International Development</reporting-org><participating-org ref="GB" type="10" role="Funding">UNITED KINGDOM</participating-org><participating-org ref="GB-1" type="10" role="Extending">Department for International Development</participating-org><iati-identifier>GB-1-100234</iati-identifier><title>Admin Project for A0011 (Uganda- Admin)</title><activity-date type="start-actual">2002-04-01Z</activity-date><activity-date type="start-planned">2002-04-01Z</activity-date><activity-status code="2">Implementation</activity-status><contact-info><organisation>Department for International Development</organisation><telephone>+44 (0) 1355 84 3132</telephone><email>enquiry@dfid.gov.uk</email><mailing-address>Public Enquiry Point, Abercrombie House, Eaglesham Road, East Kilbride, Glasgow G75 8EA</mailing-address></contact-info><default-tied-status code="5">Untied</default-tied-status><related-activity ref="GB-1-100234-105" type="2">Consultancies</related-activity><related-activity ref="GB-1-100234-125" type="2">Maintenance and Fuel for Vehicle No. CD 01 32U</related-activity><related-activity ref="GB-1-100234-126" type="2">Maintenance and Fuel for Vehicle No. CD 01 17U</related-activity><related-activity ref="GB-1-100234-127" type="2">Maintenance and Fuel for Vehicle No. CD 01 53U</related-activity><related-activity ref="GB-1-100234-128" type="2">Maintenance and Fuel for Vehicle No. CD 01 14U</related-activity><related-activity ref="GB-1-100234-129" type="2">Maintenance and Fuel for Vehicle No. CD 01 35U</related-activity><related-activity ref="GB-1-100234-130" type="2">Vehicle Running Costs</related-activity><related-activity ref="GB-1-100234-131" type="2">Maintenance and Fuel for Vehicle No. UAA 202Z</related-activity><related-activity ref="GB-1-100234-133" type="2">Vehicle RECURRENTCOSTS</related-activity></iati-activity><iati-activity xml:lang="en" default-currency="GBP" hierarchy="2"><reporting-org ref="GB-1" type="10">Department for International Development</reporting-org><participating-org ref="GB" type="10" role="Funding">UNITED KINGDOM</participating-org><participating-org ref="GB-1" type="10" role="Extending">Department for International Development</participating-org><participating-org ref="52000" role="Implementing">Other.</participating-org><recipient-region>Administrative/Capital (AC)</recipient-region><collaboration-type code="1">Bilateral</collaboration-type><default-flow-type code="10">ODA</default-flow-type><default-aid-type code="G01">Administrative costs not included elsewhere</default-aid-type><default-finance-type code="110">Aid grant excluding debt reorganisation</default-finance-type><iati-identifier>GB-1-100234-105</iati-identifier><title>Consultancies</title><sector code="91010">Administrative costs</sector><activity-date type="end-actual">2011-08-01Z</activity-date><activity-date type="end-planned">2011-08-01Z</activity-date><activity-date type="start-actual">2002-04-01Z</activity-date><activity-date type="start-planned">2002-04-01Z</activity-date><activity-status code="2">Implementation</activity-status><contact-info><organisation>Department for International Development</organisation><telephone>+44 (0) 1355 84 3132</telephone><email>enquiry@dfid.gov.uk</email><mailing-address>Public Enquiry Point, Abercrombie House, Eaglesham Road, East Kilbride, Glasgow G75 8EA</mailing-address></contact-info><default-tied-status code="5">Untied</default-tied-status><policy-marker code="1" vocabulary="DAC" significance="0">Gender Equality</policy-marker><policy-marker code="2" vocabulary="DAC" significance="0">Aid to Environment</policy-marker><policy-marker code="3" vocabulary="DAC" significance="0">Participatory Development/Good Governance</policy-marker><policy-marker code="4" vocabulary="DAC" significance="0">Trade Development</policy-marker><policy-marker code="5" vocabulary="DAC" significance="0">Aid Targeting the Objectives of the Convention on Biological Diversity</policy-marker><policy-marker code="6" vocabulary="DAC" significance="0">Aid Targeting the Objectives of the Framework Convention on Climate Change - Mitigation</policy-marker><policy-marker code="7" vocabulary="DAC" significance="0">Aid Targeting the Objectives of the Framework Convention on Climate Change - Adaptation</policy-marker><policy-marker code="8" vocabulary="DAC" significance="0">Aid Targeting the Objectives of the Convention to Combat Desertification</policy-marker><transaction><value value-date="2009-04-01Z">214323</value><transaction-type code="C">Commitment</transaction-type><transaction-date iso-date="2002-04-01Z">Total Commitment to 01 Aug 2011</transaction-date></transaction><transaction><value currency="GBP" value-date="2009-03-31Z">202861</value><transaction-type code="D">Disbursement</transaction-type><provider-org ref="GB-1" type="10">Department for International Development</provider-org><description>Aggregated spend data from 01/04/2008 to 31/03/2009</description><transaction-date iso-date="2009-03-31Z"/></transaction><transaction><value currency="GBP" value-date="2010-03-31Z">-675</value><transaction-type code="D">Disbursement</transaction-type><provider-org ref="GB-1" type="10">Department for International Development</provider-org><description>Aggregated spend data from 01/04/2009 to 31/03/2010</description><transaction-date iso-date="2010-03-31Z"/></transaction><budget type="Revised"><period-start iso-date="2008-04-01Z"/><period-end iso-date="2009-03-31Z"/><value value-date="2008-04-01Z" currency="GBP">214323</value></budget><budget type="Revised"><period-start iso-date="2009-04-01Z"/><period-end iso-date="2010-03-31Z"/><value value-date="2009-04-01Z" currency="GBP">0</value></budget><related-activity ref="GB-1-100234" type="1">Admin Project for A0011 (Uganda- Admin)</related-activity><related-activity ref="GB-1-100234-125" type="3">Maintenance and Fuel for Vehicle No. CD 01 32U</related-activity><related-activity ref="GB-1-100234-126" type="3">Maintenance and Fuel for Vehicle No. CD 01 17U</related-activity><related-activity ref="GB-1-100234-127" type="3">Maintenance and Fuel for Vehicle No. CD 01 53U</related-activity><related-activity ref="GB-1-100234-128" type="3">Maintenance and Fuel for Vehicle No. CD 01 14U</related-activity><related-activity ref="GB-1-100234-129" type="3">Maintenance and Fuel for Vehicle No. CD 01 35U</related-activity><related-activity ref="GB-1-100234-130" type="3">Vehicle Running Costs</related-activity><related-activity ref="GB-1-100234-131" type="3">Maintenance and Fuel for Vehicle No. UAA 202Z</related-activity><related-activity ref="GB-1-100234-133" type="3">Vehicle RECURRENTCOSTS</related-activity><legacy-data name="91010 Administrative Costs of Donors (Admin)" value="91010" iati-equivalent="sector"/></iati-activity><iati-activity xml:lang="en" default-currency="GBP" hierarchy="2"><reporting-org ref="GB-1" type="10">Department for International Development</reporting-org><participating-org ref="GB" type="10" role="Funding">UNITED KINGDOM</participating-org><participating-org ref="GB-1" type="10" role="Extending">Department for International Development</participating-org><participating-org ref="52000" role="Implementing">Other.</participating-org><recipient-region>Administrative/Capital (AC)</recipient-region><collaboration-type code="1">Bilateral</collaboration-type><default-flow-type code="10">ODA</default-flow-type><default-aid-type code="G01">Administrative costs not included elsewhere</default-aid-type><default-finance-type code="110">Aid grant excluding debt reorganisation</default-finance-type><iati-identifier>GB-1-100234-125</iati-identifier><title>Maintenance and Fuel for Vehicle No. CD 01 32U</title><sector code="91010">Administrative costs</sector><activity-date type="start-actual">2002-04-01Z</activity-date><activity-date type="start-planned">2002-04-01Z</activity-date><activity-status code="2">Implementation</activity-status><contact-info><organisation>Department for International Development</organisation><telephone>+44 (0) 1355 84 3132</telephone><email>enquiry@dfid.gov.uk</email><mailing-address>Public Enquiry Point, Abercrombie House, Eaglesham Road, East Kilbride, Glasgow G75 8EA</mailing-address></contact-info><default-tied-status code="5">Untied</default-tied-status><policy-marker code="1" vocabulary="DAC" significance="0">Gender Equality</policy-marker><policy-marker code="2" vocabulary="DAC" significance="0">Aid to Environment</policy-marker><policy-marker code="3" vocabulary="DAC" significance="0">Participatory Development/Good Governance</policy-marker><policy-marker code="4" vocabulary="DAC" significance="0">Trade Development</policy-marker><policy-marker code="5" vocabulary="DAC" significance="0">Aid Targeting the Objectives of the Convention on Biological Diversity</policy-marker><policy-marker code="6" vocabulary="DAC" significance="0">Aid Targeting the Objectives of the Framework Convention on Climate Change - Mitigation</policy-marker><policy-marker code="7" vocabulary="DAC" significance="0">Aid Targeting the Objectives of the Framework Convention on Climate Change - Adaptation</policy-marker><policy-marker code="8" vocabulary="DAC" significance="0">Aid Targeting the Objectives of the Convention to Combat Desertification</policy-marker><transaction><value value-date="2008-04-01Z">2494</value><transaction-type code="C">Commitment</transaction-type><transaction-date iso-date="2002-04-01Z"/></transaction><budget type="Revised"><period-start iso-date="2008-04-01Z"/><period-end iso-date="2009-03-31Z"/><value value-date="2008-04-01Z" currency="GBP">2494</value></budget><related-activity ref="GB-1-100234" type="1">Admin Project for A0011 (Uganda- Admin)</related-activity><related-activity ref="GB-1-100234-105" type="3">Consultancies</related-activity><related-activity ref="GB-1-100234-126" type="3">Maintenance and Fuel for Vehicle No. CD 01 17U</related-activity><related-activity ref="GB-1-100234-127" type="3">Maintenance and Fuel for Vehicle No. CD 01 53U</related-activity><related-activity ref="GB-1-100234-128" type="3">Maintenance and Fuel for Vehicle No. CD 01 14U</related-activity><related-activity ref="GB-1-100234-129" type="3">Maintenance and Fuel for Vehicle No. CD 01 35U</related-activity><related-activity ref="GB-1-100234-130" type="3">Vehicle Running Costs</related-activity><related-activity ref="GB-1-100234-131" type="3">Maintenance and Fuel for Vehicle No. UAA 202Z</related-activity><related-activity ref="GB-1-100234-133" type="3">Vehicle RECURRENTCOSTS</related-activity><legacy-data name="91010 Administrative Costs of Donors (Admin)" value="91010" iati-equivalent="sector"/></iati-activity><iati-activity xml:lang="en" default-currency="GBP" hierarchy="2"><reporting-org ref="GB-1" type="10">Department for International Development</reporting-org><participating-org ref="GB" type="10" role="Funding">UNITED KINGDOM</participating-org><participating-org ref="GB-1" type="10" role="Extending">Department for International Development</participating-org><participating-org ref="52000" role="Implementing">Other.</participating-org><recipient-region>Administrative/Capital (AC)</recipient-region><collaboration-type code="1">Bilateral</collaboration-type><default-flow-type code="10">ODA</default-flow-type><default-aid-type code="G01">Administrative costs not included elsewhere</default-aid-type><default-finance-type code="110">Aid grant excluding debt reorganisation</default-finance-type><iati-identifier>GB-1-100234-126</iati-identifier><title>Maintenance and Fuel for Vehicle No. CD 01 17U</title><sector code="91010">Administrative costs</sector><activity-date type="start-actual">2002-04-01Z</activity-date><activity-date type="start-planned">2002-04-01Z</activity-date><activity-status code="2">Implementation</activity-status><contact-info><organisation>Department for International Development</organisation><telephone>+44 (0) 1355 84 3132</telephone><email>enquiry@dfid.gov.uk</email><mailing-address>Public Enquiry Point, Abercrombie House, Eaglesham Road, East Kilbride, Glasgow G75 8EA</mailing-address></contact-info><default-tied-status code="5">Untied</default-tied-status><policy-marker code="1" vocabulary="DAC" significance="0">Gender Equality</policy-marker><policy-marker code="2" vocabulary="DAC" significance="0">Aid to Environment</policy-marker><policy-marker code="3" vocabulary="DAC" significance="0">Participatory Development/Good Governance</policy-marker><policy-marker code="4" vocabulary="DAC" significance="0">Trade Development</policy-marker><policy-marker code="5" vocabulary="DAC" significance="0">Aid Targeting the Objectives of the Convention on Biological Diversity</policy-marker><policy-marker code="6" vocabulary="DAC" significance="0">Aid Targeting the Objectives of the Framework Convention on Climate Change - Mitigation</policy-marker><policy-marker code="7" vocabulary="DAC" significance="0">Aid Targeting the Objectives of the Framework Convention on Climate Change - Adaptation</policy-marker><policy-marker code="8" vocabulary="DAC" significance="0">Aid Targeting the Objectives of the Convention to Combat Desertification</policy-marker><transaction><value value-date="2008-04-01Z">4561</value><transaction-type code="C">Commitment</transaction-type><transaction-date iso-date="2002-04-01Z"/></transaction><transaction><value currency="GBP" value-date="2009-03-31Z">1321</value><transaction-type code="D">Disbursement</transaction-type><provider-org ref="GB-1" type="10">Department for International Development</provider-org><description>Aggregated spend data from 01/04/2008 to 31/03/2009</description><transaction-date iso-date="2009-03-31Z"/></transaction><budget type="Revised"><period-start iso-date="2008-04-01Z"/><period-end iso-date="2009-03-31Z"/><value value-date="2008-04-01Z" currency="GBP">4561</value></budget><related-activity ref="GB-1-100234" type="1">Admin Project for A0011 (Uganda- Admin)</related-activity><related-activity ref="GB-1-100234-105" type="3">Consultancies</related-activity><related-activity ref="GB-1-100234-125" type="3">Maintenance and Fuel for Vehicle No. CD 01 32U</related-activity><related-activity ref="GB-1-100234-127" type="3">Maintenance and Fuel for Vehicle No. CD 01 53U</related-activity><related-activity ref="GB-1-100234-128" type="3">Maintenance and Fuel for Vehicle No. CD 01 14U</related-activity><related-activity ref="GB-1-100234-129" type="3">Maintenance and Fuel for Vehicle No. CD 01 35U</related-activity><related-activity ref="GB-1-100234-130" type="3">Vehicle Running Costs</related-activity><related-activity ref="GB-1-100234-131" type="3">Maintenance and Fuel for Vehicle No. UAA 202Z</related-activity><related-activity ref="GB-1-100234-133" type="3">Vehicle RECURRENTCOSTS</related-activity><legacy-data name="91010 Administrative Costs of Donors (Admin)" value="91010" iati-equivalent="sector"/></iati-activity><iati-activity xml:lang="en" default-currency="GBP" hierarchy="2"><reporting-org ref="GB-1" type="10">Department for International Development</reporting-org><participating-org ref="GB" type="10" role="Funding">UNITED KINGDOM</participating-org><participating-org ref="GB-1" type="10" role="Extending">Department for International Development</participating-org><participating-org ref="52000" role="Implementing">Other.</participating-org><recipient-region>Administrative/Capital (AC)</recipient-region><collaboration-type code="1">Bilateral</collaboration-type><default-flow-type code="10">ODA</default-flow-type><default-aid-type code="G01">Administrative costs not included elsewhere</default-aid-type><default-finance-type code="110">Aid grant excluding debt reorganisation</default-finance-type><iati-identifier>GB-1-100234-127</iati-identifier><title>Maintenance and Fuel for Vehicle No. CD 01 53U</title><sector code="91010">Administrative costs</sector><activity-date type="start-actual">2002-04-01Z</activity-date><activity-date type="start-planned">2002-04-01Z</activity-date><activity-status code="2">Implementation</activity-status><contact-info><organisation>Department for International Development</organisation><telephone>+44 (0) 1355 84 3132</telephone><email>enquiry@dfid.gov.uk</email><mailing-address>Public Enquiry Point, Abercrombie House, Eaglesham Road, East Kilbride, Glasgow G75 8EA</mailing-address></contact-info><default-tied-status code="5">Untied</default-tied-status><policy-marker code="1" vocabulary="DAC" significance="0">Gender Equality</policy-marker><policy-marker code="2" vocabulary="DAC" significance="0">Aid to Environment</policy-marker><policy-marker code="3" vocabulary="DAC" significance="0">Participatory Development/Good Governance</policy-marker><policy-marker code="4" vocabulary="DAC" significance="0">Trade Development</policy-marker><policy-marker code="5" vocabulary="DAC" significance="0">Aid Targeting the Objectives of the Convention on Biological Diversity</policy-marker><policy-marker code="6" vocabulary="DAC" significance="0">Aid Targeting the Objectives of the Framework Convention on Climate Change - Mitigation</policy-marker><policy-marker code="7" vocabulary="DAC" significance="0">Aid Targeting the Objectives of the Framework Convention on Climate Change - Adaptation</policy-marker><policy-marker code="8" vocabulary="DAC" significance="0">Aid Targeting the Objectives of the Convention to Combat Desertification</policy-marker><transaction><value value-date="2008-04-01Z">2500</value><transaction-type code="C">Commitment</transaction-type><transaction-date iso-date="2002-04-01Z"/></transaction><transaction><value currency="GBP" value-date="2009-03-31Z">645</value><transaction-type code="D">Disbursement</transaction-type><provider-org ref="GB-1" type="10">Department for International Development</provider-org><description>Aggregated spend data from 01/04/2008 to 31/03/2009</description><transaction-date iso-date="2009-03-31Z"/></transaction><budget type="Revised"><period-start iso-date="2008-04-01Z"/><period-end iso-date="2009-03-31Z"/><value value-date="2008-04-01Z" currency="GBP">2500</value></budget><related-activity ref="GB-1-100234" type="1">Admin Project for A0011 (Uganda- Admin)</related-activity><related-activity ref="GB-1-100234-105" type="3">Consultancies</related-activity><related-activity ref="GB-1-100234-125" type="3">Maintenance and Fuel for Vehicle No. CD 01 32U</related-activity><related-activity ref="GB-1-100234-126" type="3">Maintenance and Fuel for Vehicle No. CD 01 17U</related-activity><related-activity ref="GB-1-100234-128" type="3">Maintenance and Fuel for Vehicle No. CD 01 14U</related-activity><related-activity ref="GB-1-100234-129" type="3">Maintenance and Fuel for Vehicle No. CD 01 35U</related-activity><related-activity ref="GB-1-100234-130" type="3">Vehicle Running Costs</related-activity><related-activity ref="GB-1-100234-131" type="3">Maintenance and Fuel for Vehicle No. UAA 202Z</related-activity><related-activity ref="GB-1-100234-133" type="3">Vehicle RECURRENTCOSTS</related-activity><legacy-data name="91010 Administrative Costs of Donors (Admin)" value="91010" iati-equivalent="sector"/></iati-activity><iati-activity xml:lang="en" default-currency="GBP" hierarchy="2"><reporting-org ref="GB-1" type="10">Department for International Development</reporting-org><participating-org ref="GB" type="10" role="Funding">UNITED KINGDOM</participating-org><participating-org ref="GB-1" type="10" role="Extending">Department for International Development</participating-org><participating-org ref="52000" role="Implementing">Other.</participating-org><recipient-region>Administrative/Capital (AC)</recipient-region><collaboration-type code="1">Bilateral</collaboration-type><default-flow-type code="10">ODA</default-flow-type><default-aid-type code="G01">Administrative costs not included elsewhere</default-aid-type><default-finance-type code="110">Aid grant excluding debt reorganisation</default-finance-type><iati-identifier>GB-1-100234-128</iati-identifier><title>Maintenance and Fuel for Vehicle No. CD 01 14U</title><sector code="91010">Administrative costs</sector><activity-date type="start-actual">2002-04-01Z</activity-date><activity-date type="start-planned">2002-04-01Z</activity-date><activity-status code="2">Implementation</activity-status><contact-info><organisation>Department for International Development</organisation><telephone>+44 (0) 1355 84 3132</telephone><email>enquiry@dfid.gov.uk</email><mailing-address>Public Enquiry Point, Abercrombie House, Eaglesham Road, East Kilbride, Glasgow G75 8EA</mailing-address></contact-info><default-tied-status code="5">Untied</default-tied-status><policy-marker code="1" vocabulary="DAC" significance="0">Gender Equality</policy-marker><policy-marker code="2" vocabulary="DAC" significance="0">Aid to Environment</policy-marker><policy-marker code="3" vocabulary="DAC" significance="0">Participatory Development/Good Governance</policy-marker><policy-marker code="4" vocabulary="DAC" significance="0">Trade Development</policy-marker><policy-marker code="5" vocabulary="DAC" significance="0">Aid Targeting the Objectives of the Convention on Biological Diversity</policy-marker><policy-marker code="6" vocabulary="DAC" significance="0">Aid Targeting the Objectives of the Framework Convention on Climate Change - Mitigation</policy-marker><policy-marker code="7" vocabulary="DAC" significance="0">Aid Targeting the Objectives of the Framework Convention on Climate Change - Adaptation</policy-marker><policy-marker code="8" vocabulary="DAC" significance="0">Aid Targeting the Objectives of the Convention to Combat Desertification</policy-marker><transaction><value value-date="2008-04-01Z">2449</value><transaction-type code="C">Commitment</transaction-type><transaction-date iso-date="2002-04-01Z"/></transaction><transaction><value currency="GBP" value-date="2009-03-31Z">897</value><transaction-type code="D">Disbursement</transaction-type><provider-org ref="GB-1" type="10">Department for International Development</provider-org><description>Aggregated spend data from 01/04/2008 to 31/03/2009</description><transaction-date iso-date="2009-03-31Z"/></transaction><budget type="Revised"><period-start iso-date="2008-04-01Z"/><period-end iso-date="2009-03-31Z"/><value value-date="2008-04-01Z" currency="GBP">2449</value></budget><related-activity ref="GB-1-100234" type="1">Admin Project for A0011 (Uganda- Admin)</related-activity><related-activity ref="GB-1-100234-105" type="3">Consultancies</related-activity><related-activity ref="GB-1-100234-125" type="3">Maintenance and Fuel for Vehicle No. CD 01 32U</related-activity><related-activity ref="GB-1-100234-126" type="3">Maintenance and Fuel for Vehicle No. CD 01 17U</related-activity><related-activity ref="GB-1-100234-127" type="3">Maintenance and Fuel for Vehicle No. CD 01 53U</related-activity><related-activity ref="GB-1-100234-129" type="3">Maintenance and Fuel for Vehicle No. CD 01 35U</related-activity><related-activity ref="GB-1-100234-130" type="3">Vehicle Running Costs</related-activity><related-activity ref="GB-1-100234-131" type="3">Maintenance and Fuel for Vehicle No. UAA 202Z</related-activity><related-activity ref="GB-1-100234-133" type="3">Vehicle RECURRENTCOSTS</related-activity><legacy-data name="91010 Administrative Costs of Donors (Admin)" value="91010" iati-equivalent="sector"/></iati-activity><iati-activity xml:lang="en" default-currency="GBP" hierarchy="2"><reporting-org ref="GB-1" type="10">Department for International Development</reporting-org><participating-org ref="GB" type="10" role="Funding">UNITED KINGDOM</participating-org><participating-org ref="GB-1" type="10" role="Extending">Department for International Development</participating-org><participating-org ref="52000" role="Implementing">Other.</participating-org><recipient-region>Administrative/Capital (AC)</recipient-region><collaboration-type code="1">Bilateral</collaboration-type><default-flow-type code="10">ODA</default-flow-type><default-aid-type code="G01">Administrative costs not included elsewhere</default-aid-type><default-finance-type code="110">Aid grant excluding debt reorganisation</default-finance-type><iati-identifier>GB-1-100234-129</iati-identifier><title>Maintenance and Fuel for Vehicle No. CD 01 35U</title><sector code="91010">Administrative costs</sector><activity-date type="start-actual">2002-04-01Z</activity-date><activity-date type="start-planned">2002-04-01Z</activity-date><activity-status code="2">Implementation</activity-status><contact-info><organisation>Department for International Development</organisation><telephone>+44 (0) 1355 84 3132</telephone><email>enquiry@dfid.gov.uk</email><mailing-address>Public Enquiry Point, Abercrombie House, Eaglesham Road, East Kilbride, Glasgow G75 8EA</mailing-address></contact-info><default-tied-status code="5">Untied</default-tied-status><policy-marker code="1" vocabulary="DAC" significance="0">Gender Equality</policy-marker><policy-marker code="2" vocabulary="DAC" significance="0">Aid to Environment</policy-marker><policy-marker code="3" vocabulary="DAC" significance="0">Participatory Development/Good Governance</policy-marker><policy-marker code="4" vocabulary="DAC" significance="0">Trade Development</policy-marker><policy-marker code="5" vocabulary="DAC" significance="0">Aid Targeting the Objectives of the Convention on Biological Diversity</policy-marker><policy-marker code="6" vocabulary="DAC" significance="0">Aid Targeting the Objectives of the Framework Convention on Climate Change - Mitigation</policy-marker><policy-marker code="7" vocabulary="DAC" significance="0">Aid Targeting the Objectives of the Framework Convention on Climate Change - Adaptation</policy-marker><policy-marker code="8" vocabulary="DAC" significance="0">Aid Targeting the Objectives of the Convention to Combat Desertification</policy-marker><transaction><value value-date="2008-04-01Z">4874</value><transaction-type code="C">Commitment</transaction-type><transaction-date iso-date="2002-04-01Z"/></transaction><transaction><value currency="GBP" value-date="2009-03-31Z">2138</value><transaction-type code="D">Disbursement</transaction-type><provider-org ref="GB-1" type="10">Department for International Development</provider-org><description>Aggregated spend data from 01/04/2008 to 31/03/2009</description><transaction-date iso-date="2009-03-31Z"/></transaction><budget type="Revised"><period-start iso-date="2008-04-01Z"/><period-end iso-date="2009-03-31Z"/><value value-date="2008-04-01Z" currency="GBP">4874</value></budget><related-activity ref="GB-1-100234" type="1">Admin Project for A0011 (Uganda- Admin)</related-activity><related-activity ref="GB-1-100234-105" type="3">Consultancies</related-activity><related-activity ref="GB-1-100234-125" type="3">Maintenance and Fuel for Vehicle No. CD 01 32U</related-activity><related-activity ref="GB-1-100234-126" type="3">Maintenance and Fuel for Vehicle No. CD 01 17U</related-activity><related-activity ref="GB-1-100234-127" type="3">Maintenance and Fuel for Vehicle No. CD 01 53U</related-activity><related-activity ref="GB-1-100234-128" type="3">Maintenance and Fuel for Vehicle No. CD 01 14U</related-activity><related-activity ref="GB-1-100234-130" type="3">Vehicle Running Costs</related-activity><related-activity ref="GB-1-100234-131" type="3">Maintenance and Fuel for Vehicle No. UAA 202Z</related-activity><related-activity ref="GB-1-100234-133" type="3">Vehicle RECURRENTCOSTS</related-activity><legacy-data name="91010 Administrative Costs of Donors (Admin)" value="91010" iati-equivalent="sector"/></iati-activity><iati-activity xml:lang="en" default-currency="GBP" hierarchy="2"><reporting-org ref="GB-1" type="10">Department for International Development</reporting-org><participating-org ref="GB" type="10" role="Funding">UNITED KINGDOM</participating-org><participating-org ref="GB-1" type="10" role="Extending">Department for International Development</participating-org><participating-org ref="52000" role="Implementing">Other.</participating-org><recipient-region>Administrative/Capital (AC)</recipient-region><collaboration-type code="1">Bilateral</collaboration-type><default-flow-type code="10">ODA</default-flow-type><default-aid-type code="G01">Administrative costs not included elsewhere</default-aid-type><default-finance-type code="110">Aid grant excluding debt reorganisation</default-finance-type><iati-identifier>GB-1-100234-130</iati-identifier><title>Vehicle Running Costs</title><sector code="91010">Administrative costs</sector><activity-date type="start-actual">2002-04-01Z</activity-date><activity-date type="start-planned">2002-04-01Z</activity-date><activity-status code="2">Implementation</activity-status><contact-info><organisation>Department for International Development</organisation><telephone>+44 (0) 1355 84 3132</telephone><email>enquiry@dfid.gov.uk</email><mailing-address>Public Enquiry Point, Abercrombie House, Eaglesham Road, East Kilbride, Glasgow G75 8EA</mailing-address></contact-info><default-tied-status code="5">Untied</default-tied-status><policy-marker code="1" vocabulary="DAC" significance="0">Gender Equality</policy-marker><policy-marker code="2" vocabulary="DAC" significance="0">Aid to Environment</policy-marker><policy-marker code="3" vocabulary="DAC" significance="0">Participatory Development/Good Governance</policy-marker><policy-marker code="4" vocabulary="DAC" significance="0">Trade Development</policy-marker><policy-marker code="5" vocabulary="DAC" significance="0">Aid Targeting the Objectives of the Convention on Biological Diversity</policy-marker><policy-marker code="6" vocabulary="DAC" significance="0">Aid Targeting the Objectives of the Framework Convention on Climate Change - Mitigation</policy-marker><policy-marker code="7" vocabulary="DAC" significance="0">Aid Targeting the Objectives of the Framework Convention on Climate Change - Adaptation</policy-marker><policy-marker code="8" vocabulary="DAC" significance="0">Aid Targeting the Objectives of the Convention to Combat Desertification</policy-marker><transaction><value value-date="2009-04-01Z">20544</value><transaction-type code="C">Commitment</transaction-type><transaction-date iso-date="2002-04-01Z"/></transaction><transaction><value currency="GBP" value-date="2010-03-31Z">16347</value><transaction-type code="D">Disbursement</transaction-type><provider-org ref="GB-1" type="10">Department for International Development</provider-org><description>Aggregated spend data from 01/04/2009 to 31/03/2010</description><transaction-date iso-date="2010-03-31Z"/></transaction><budget type="Revised"><period-start iso-date="2008-04-01Z"/><period-end iso-date="2009-03-31Z"/><value value-date="2008-04-01Z" currency="GBP">544</value></budget><budget type="Revised"><period-start iso-date="2009-04-01Z"/><period-end iso-date="2010-03-31Z"/><value value-date="2009-04-01Z" currency="GBP">20000</value></budget><related-activity ref="GB-1-100234" type="1">Admin Project for A0011 (Uganda- Admin)</related-activity><related-activity ref="GB-1-100234-105" type="3">Consultancies</related-activity><related-activity ref="GB-1-100234-125" type="3">Maintenance and Fuel for Vehicle No. CD 01 32U</related-activity><related-activity ref="GB-1-100234-126" type="3">Maintenance and Fuel for Vehicle No. CD 01 17U</related-activity><related-activity ref="GB-1-100234-127" type="3">Maintenance and Fuel for Vehicle No. CD 01 53U</related-activity><related-activity ref="GB-1-100234-128" type="3">Maintenance and Fuel for Vehicle No. CD 01 14U</related-activity><related-activity ref="GB-1-100234-129" type="3">Maintenance and Fuel for Vehicle No. CD 01 35U</related-activity><related-activity ref="GB-1-100234-131" type="3">Maintenance and Fuel for Vehicle No. UAA 202Z</related-activity><related-activity ref="GB-1-100234-133" type="3">Vehicle RECURRENTCOSTS</related-activity><legacy-data name="91010 Administrative Costs of Donors (Admin)" value="91010" iati-equivalent="sector"/></iati-activity><iati-activity xml:lang="en" default-currency="GBP" hierarchy="2"><reporting-org ref="GB-1" type="10">Department for International Development</reporting-org><participating-org ref="GB" type="10" role="Funding">UNITED KINGDOM</participating-org><participating-org ref="GB-1" type="10" role="Extending">Department for International Development</participating-org><participating-org ref="52000" role="Implementing">Other.</participating-org><recipient-region>Administrative/Capital (AC)</recipient-region><collaboration-type code="1">Bilateral</collaboration-type><default-flow-type code="10">ODA</default-flow-type><default-aid-type code="G01">Administrative costs not included elsewhere</default-aid-type><default-finance-type code="110">Aid grant excluding debt reorganisation</default-finance-type><iati-identifier>GB-1-100234-131</iati-identifier><title>Maintenance and Fuel for Vehicle No. UAA 202Z</title><sector code="91010">Administrative costs</sector><activity-date type="start-actual">2002-04-01Z</activity-date><activity-date type="start-planned">2002-04-01Z</activity-date><activity-status code="2">Implementation</activity-status><contact-info><organisation>Department for International Development</organisation><telephone>+44 (0) 1355 84 3132</telephone><email>enquiry@dfid.gov.uk</email><mailing-address>Public Enquiry Point, Abercrombie House, Eaglesham Road, East Kilbride, Glasgow G75 8EA</mailing-address></contact-info><default-tied-status code="5">Untied</default-tied-status><policy-marker code="1" vocabulary="DAC" significance="0">Gender Equality</policy-marker><policy-marker code="2" vocabulary="DAC" significance="0">Aid to Environment</policy-marker><policy-marker code="3" vocabulary="DAC" significance="0">Participatory Development/Good Governance</policy-marker><policy-marker code="4" vocabulary="DAC" significance="0">Trade Development</policy-marker><policy-marker code="5" vocabulary="DAC" significance="0">Aid Targeting the Objectives of the Convention on Biological Diversity</policy-marker><policy-marker code="6" vocabulary="DAC" significance="0">Aid Targeting the Objectives of the Framework Convention on Climate Change - Mitigation</policy-marker><policy-marker code="7" vocabulary="DAC" significance="0">Aid Targeting the Objectives of the Framework Convention on Climate Change - Adaptation</policy-marker><policy-marker code="8" vocabulary="DAC" significance="0">Aid Targeting the Objectives of the Convention to Combat Desertification</policy-marker><transaction><value value-date="2008-04-01Z">2671</value><transaction-type code="C">Commitment</transaction-type><transaction-date iso-date="2002-04-01Z"/></transaction><transaction><value currency="GBP" value-date="2009-03-31Z">1666</value><transaction-type code="D">Disbursement</transaction-type><provider-org ref="GB-1" type="10">Department for International Development</provider-org><description>Aggregated spend data from 01/04/2008 to 31/03/2009</description><transaction-date iso-date="2009-03-31Z"/></transaction><budget type="Revised"><period-start iso-date="2008-04-01Z"/><period-end iso-date="2009-03-31Z"/><value value-date="2008-04-01Z" currency="GBP">2671</value></budget><related-activity ref="GB-1-100234" type="1">Admin Project for A0011 (Uganda- Admin)</related-activity><related-activity ref="GB-1-100234-105" type="3">Consultancies</related-activity><related-activity ref="GB-1-100234-125" type="3">Maintenance and Fuel for Vehicle No. CD 01 32U</related-activity><related-activity ref="GB-1-100234-126" type="3">Maintenance and Fuel for Vehicle No. CD 01 17U</related-activity><related-activity ref="GB-1-100234-127" type="3">Maintenance and Fuel for Vehicle No. CD 01 53U</related-activity><related-activity ref="GB-1-100234-128" type="3">Maintenance and Fuel for Vehicle No. CD 01 14U</related-activity><related-activity ref="GB-1-100234-129" type="3">Maintenance and Fuel for Vehicle No. CD 01 35U</related-activity><related-activity ref="GB-1-100234-130" type="3">Vehicle Running Costs</related-activity><related-activity ref="GB-1-100234-133" type="3">Vehicle RECURRENTCOSTS</related-activity><legacy-data name="91010 Administrative Costs of Donors (Admin)" value="91010" iati-equivalent="sector"/></iati-activity><iati-activity xml:lang="en" default-currency="GBP" hierarchy="2"><reporting-org ref="GB-1" type="10">Department for International Development</reporting-org><participating-org ref="GB" type="10" role="Funding">UNITED KINGDOM</participating-org><participating-org ref="GB-1" type="10" role="Extending">Department for International Development</participating-org><participating-org ref="52000" role="Implementing">Other.</participating-org><recipient-region>Administrative/Capital (AC)</recipient-region><collaboration-type code="1">Bilateral</collaboration-type><default-flow-type code="10">ODA</default-flow-type><default-aid-type code="G01">Administrative costs not included elsewhere</default-aid-type><default-finance-type code="110">Aid grant excluding debt reorganisation</default-finance-type><iati-identifier>GB-1-100234-133</iati-identifier><title>Vehicle RECURRENTCOSTS</title><sector code="91010">Administrative costs</sector><activity-date type="start-actual">2002-04-01Z</activity-date><activity-date type="start-planned">2002-04-01Z</activity-date><activity-status code="2">Implementation</activity-status><contact-info><organisation>Department for International Development</organisation><telephone>+44 (0) 1355 84 3132</telephone><email>enquiry@dfid.gov.uk</email><mailing-address>Public Enquiry Point, Abercrombie House, Eaglesham Road, East Kilbride, Glasgow G75 8EA</mailing-address></contact-info><default-tied-status code="5">Untied</default-tied-status><policy-marker code="1" vocabulary="DAC" significance="0">Gender Equality</policy-marker><policy-marker code="2" vocabulary="DAC" significance="0">Aid to Environment</policy-marker><policy-marker code="3" vocabulary="DAC" significance="0">Participatory Development/Good Governance</policy-marker><policy-marker code="4" vocabulary="DAC" significance="0">Trade Development</policy-marker><policy-marker code="5" vocabulary="DAC" significance="0">Aid Targeting the Objectives of the Convention on Biological Diversity</policy-marker><policy-marker code="6" vocabulary="DAC" significance="0">Aid Targeting the Objectives of the Framework Convention on Climate Change - Mitigation</policy-marker><policy-marker code="7" vocabulary="DAC" significance="0">Aid Targeting the Objectives of the Framework Convention on Climate Change - Adaptation</policy-marker><policy-marker code="8" vocabulary="DAC" significance="0">Aid Targeting the Objectives of the Convention to Combat Desertification</policy-marker><transaction><value value-date="2009-04-01Z">1148</value><transaction-type code="C">Commitment</transaction-type><transaction-date iso-date="2002-04-01Z"/></transaction><transaction><value currency="GBP" value-date="2009-03-31Z">645</value><transaction-type code="D">Disbursement</transaction-type><provider-org ref="GB-1" type="10">Department for International Development</provider-org><description>Aggregated spend data from 01/04/2008 to 31/03/2009</description><transaction-date iso-date="2009-03-31Z"/></transaction><transaction><value currency="GBP" value-date="2010-03-31Z">-4692</value><transaction-type code="D">Disbursement</transaction-type><provider-org ref="GB-1" type="10">Department for International Development</provider-org><description>Aggregated spend data from 01/04/2009 to 31/03/2010</description><transaction-date iso-date="2010-03-31Z"/></transaction><budget type="Revised"><period-start iso-date="2008-04-01Z"/><period-end iso-date="2009-03-31Z"/><value value-date="2008-04-01Z" currency="GBP">1148</value></budget><related-activity ref="GB-1-100234" type="1">Admin Project for A0011 (Uganda- Admin)</related-activity><related-activity ref="GB-1-100234-105" type="3">Consultancies</related-activity><related-activity ref="GB-1-100234-125" type="3">Maintenance and Fuel for Vehicle No. CD 01 32U</related-activity><related-activity ref="GB-1-100234-126" type="3">Maintenance and Fuel for Vehicle No. CD 01 17U</related-activity><related-activity ref="GB-1-100234-127" type="3">Maintenance and Fuel for Vehicle No. CD 01 53U</related-activity><related-activity ref="GB-1-100234-128" type="3">Maintenance and Fuel for Vehicle No. CD 01 14U</related-activity><related-activity ref="GB-1-100234-129" type="3">Maintenance and Fuel for Vehicle No. CD 01 35U</related-activity><related-activity ref="GB-1-100234-130" type="3">Vehicle Running Costs</related-activity><related-activity ref="GB-1-100234-131" type="3">Maintenance and Fuel for Vehicle No. UAA 202Z</related-activity><legacy-data name="91010 Administrative Costs of Donors (Admin)" value="91010" iati-equivalent="sector"/></iati-activity><iati-activity xml:lang="en" default-currency="GBP" hierarchy="1"><reporting-org ref="GB-1" type="10">Department for International Development</reporting-org><participating-org ref="GB" type="10" role="Funding">UNITED KINGDOM</participating-org><participating-org ref="GB-1" type="10" role="Extending">Department for International Development</participating-org><iati-identifier>GB-1-113184</iati-identifier><title>Eval.&amp; Disseminat'n R &amp; D</title><description>To disseminate the research results for ODA funded research into Renewable Natural Resources</description><activity-date type="end-actual">2010-06-30Z</activity-date><activity-date type="end-planned">2010-06-30Z</activity-date><activity-date type="start-actual">1990-04-01Z</activity-date><activity-date type="start-planned">1990-04-01Z</activity-date><activity-status code="4">Post-completion</activity-status><contact-info><organisation>Department for International Development</organisation><telephone>+44 (0) 1355 84 3132</telephone><email>enquiry@dfid.gov.uk</email><mailing-address>Public Enquiry Point, Abercrombie House, Eaglesham Road, East Kilbride, Glasgow G75 8EA</mailing-address></contact-info><default-tied-status code="5">Untied</default-tied-status><related-activity ref="GB-1-113184-101" type="2">PROCOFSERVICES and P0113 for Eval.&amp; Disseminat'n R &amp; D</related-activity><related-activity ref="GB-1-113184-102" type="2">PROCOFSERVICES and P0112 for Eval.&amp; Disseminat'n R &amp; D</related-activity></iati-activity><iati-activity xml:lang="en" default-currency="GBP" hierarchy="2"><reporting-org ref="GB-1" type="10">Department for International Development</reporting-org><participating-org ref="GB" type="10" role="Funding">UNITED KINGDOM</participating-org><participating-org ref="GB-1" type="10" role="Extending">Department for International Development</participating-org><participating-org ref="52000" role="Implementing">Other.</participating-org><recipient-region>Administrative/Capital (AC)</recipient-region><collaboration-type code="1">Bilateral</collaboration-type><default-flow-type code="10">ODA</default-flow-type><default-aid-type code="C01">Project-type interventions</default-aid-type><default-finance-type code="110">Aid grant excluding debt reorganisation</default-finance-type><iati-identifier>GB-1-113184-101</iati-identifier><title>PROCOFSERVICES and P0113 for Eval.&amp; Disseminat'n R &amp; D</title><sector code="41082">Environmental Research</sector><activity-date type="start-actual">1990-04-01Z</activity-date><activity-date type="start-planned">1990-04-01Z</activity-date><activity-status code="4">Post-completion</activity-status><contact-info><organisation>Department for International Development</organisation><telephone>+44 (0) 1355 84 3132</telephone><email>enquiry@dfid.gov.uk</email><mailing-address>Public Enquiry Point, Abercrombie House, Eaglesham Road, East Kilbride, Glasgow G75 8EA</mailing-address></contact-info><default-tied-status code="5">Untied</default-tied-status><policy-marker code="1" vocabulary="DAC" significance="0">Gender Equality</policy-marker><policy-marker code="2" vocabulary="DAC" significance="0">Aid to Environment</policy-marker><policy-marker code="3" vocabulary="DAC" significance="0">Participatory Development/Good Governance</policy-marker><policy-marker code="4" vocabulary="DAC" significance="0">Trade Development</policy-marker><policy-marker code="5" vocabulary="DAC" significance="0">Aid Targeting the Objectives of the Convention on Biological Diversity</policy-marker><policy-marker code="6" vocabulary="DAC" significance="0">Aid Targeting the Objectives of the Framework Convention on Climate Change - Mitigation</policy-marker><policy-marker code="7" vocabulary="DAC" significance="0">Aid Targeting the Objectives of the Framework Convention on Climate Change - Adaptation</policy-marker><policy-marker code="8" vocabulary="DAC" significance="0">Aid Targeting the Objectives of the Convention to Combat Desertification</policy-marker><transaction><value value-date="2009-04-01Z">3078950</value><transaction-type code="C">Commitment</transaction-type><transaction-date iso-date="1990-04-01Z"/></transaction><transaction><value currency="GBP" value-date="2002-03-31Z">2572686</value><transaction-type code="D">Disbursement</transaction-type><provider-org ref="GB-1" type="10">Department for International Development</provider-org><description>Aggregated spend data from 01/04/2001 to 31/03/2002</description><transaction-date iso-date="2002-03-31Z"/></transaction><transaction><value currency="GBP" value-date="2003-03-31Z">276559</value><transaction-type code="D">Disbursement</transaction-type><provider-org ref="GB-1" type="10">Department for International Development</provider-org><description>Aggregated spend data from 01/04/2002 to 31/03/2003</description><transaction-date iso-date="2003-03-31Z"/></transaction><transaction><value currency="GBP" value-date="2004-03-31Z">51018</value><transaction-type code="D">Disbursement</transaction-type><provider-org ref="GB-1" type="10">Department for International Development</provider-org><description>Aggregated spend data from 01/04/2003 to 31/03/2004</description><transaction-date iso-date="2004-03-31Z"/></transaction><transaction><value currency="GBP" value-date="2005-03-31Z">54005</value><transaction-type code="D">Disbursement</transaction-type><provider-org ref="GB-1" type="10">Department for International Development</provider-org><description>Aggregated spend data from 01/04/2004 to 31/03/2005</description><transaction-date iso-date="2005-03-31Z"/></transaction><transaction><value currency="GBP" value-date="2006-03-31Z">80817</value><transaction-type code="D">Disbursement</transaction-type><provider-org ref="GB-1" type="10">Department for International Development</provider-org><description>Aggregated spend data from 01/04/2005 to 31/03/2006</description><transaction-date iso-date="2006-03-31Z"/></transaction><transaction><value currency="GBP" value-date="2007-03-31Z">28722</value><transaction-type code="D">Disbursement</transaction-type><provider-org ref="GB-1" type="10">Department for International Development</provider-org><description>Aggregated spend data from 01/04/2006 to 31/03/2007</description><transaction-date iso-date="2007-03-31Z"/></transaction><transaction><value currency="GBP" value-date="2009-03-31Z">6837</value><transaction-type code="D">Disbursement</transaction-type><provider-org ref="GB-1" type="10">Department for International Development</provider-org><description>Aggregated spend data from 01/04/2008 to 31/03/2009</description><transaction-date iso-date="2009-03-31Z"/></transaction><budget type="Original"><period-start iso-date="2001-04-01Z"/><period-end iso-date="2002-03-31Z"/><value value-date="2001-04-01Z" currency="GBP">2577692</value></budget><budget type="Original"><period-start iso-date="2002-04-01Z"/><period-end iso-date="2003-03-31Z"/><value value-date="2002-04-01Z" currency="GBP">277412</value></budget><budget type="Original"><period-start iso-date="2003-04-01Z"/><period-end iso-date="2004-03-31Z"/><value value-date="2003-04-01Z" currency="GBP">53018</value></budget><budget type="Original"><period-start iso-date="2004-04-01Z"/><period-end iso-date="2005-03-31Z"/><value value-date="2004-04-01Z" currency="GBP">50083</value></budget><budget type="Original"><period-start iso-date="2005-04-01Z"/><period-end iso-date="2006-03-31Z"/><value value-date="2005-04-01Z" currency="GBP">95757</value></budget><budget type="Original"><period-start iso-date="2006-04-01Z"/><period-end iso-date="2007-03-31Z"/><value value-date="2006-04-01Z" currency="GBP">22619</value></budget><budget type="Revised"><period-start iso-date="2008-04-01Z"/><period-end iso-date="2009-03-31Z"/><value value-date="2008-04-01Z" currency="GBP">6837</value></budget><budget type="Revised"><period-start iso-date="2009-04-01Z"/><period-end iso-date="2010-03-31Z"/><value value-date="2009-04-01Z" currency="GBP">-4469</value></budget><related-activity ref="GB-1-113184" type="1">Eval.&amp; Disseminat'n R &amp; D</related-activity><related-activity ref="GB-1-113184-102" type="3">PROCOFSERVICES and P0112 for Eval.&amp; Disseminat'n R &amp; D</related-activity><legacy-data name="80017 Renewable Natural Resources Research (Global Partnerships)" value="80017" iati-equivalent="sector"/></iati-activity><iati-activity xml:lang="en" default-currency="GBP" hierarchy="2"><reporting-org ref="GB-1" type="10">Department for International Development</reporting-org><participating-org ref="GB" type="10" role="Funding">UNITED KINGDOM</participating-org><participating-org ref="GB-1" type="10" role="Extending">Department for International Development</participating-org><participating-org ref="22000" role="Implementing">Donor country-based NGO</participating-org><recipient-region>Administrative/Capital (AC)</recipient-region><collaboration-type code="5">Aid through NGOs</collaboration-type><default-flow-type code="10">ODA</default-flow-type><default-aid-type code="C01">Project-type interventions</default-aid-type><default-finance-type code="110">Aid grant excluding debt reorganisation</default-finance-type><iati-identifier>GB-1-113184-102</iati-identifier><title>PROCOFSERVICES and P0112 for Eval.&amp; Disseminat'n R &amp; D</title><sector code="41082">Environmental Research</sector><activity-date type="start-actual">1990-04-01Z</activity-date><activity-date type="start-planned">1990-04-01Z</activity-date><activity-status code="4">Post-completion</activity-status><contact-info><organisation>Department for International Development</organisation><telephone>+44 (0) 1355 84 3132</telephone><email>enquiry@dfid.gov.uk</email><mailing-address>Public Enquiry Point, Abercrombie House, Eaglesham Road, East Kilbride, Glasgow G75 8EA</mailing-address></contact-info><default-tied-status code="5">Untied</default-tied-status><policy-marker code="1" vocabulary="DAC" significance="0">Gender Equality</policy-marker><policy-marker code="2" vocabulary="DAC" significance="0">Aid to Environment</policy-marker><policy-marker code="3" vocabulary="DAC" significance="0">Participatory Development/Good Governance</policy-marker><policy-marker code="4" vocabulary="DAC" significance="0">Trade Development</policy-marker><policy-marker code="5" vocabulary="DAC" significance="0">Aid Targeting the Objectives of the Convention on Biological Diversity</policy-marker><policy-marker code="6" vocabulary="DAC" significance="0">Aid Targeting the Objectives of the Framework Convention on Climate Change - Mitigation</policy-marker><policy-marker code="7" vocabulary="DAC" significance="0">Aid Targeting the Objectives of the Framework Convention on Climate Change - Adaptation</policy-marker><policy-marker code="8" vocabulary="DAC" significance="0">Aid Targeting the Objectives of the Convention to Combat Desertification</policy-marker><transaction><value value-date="2009-04-01Z">24106</value><transaction-type code="C">Commitment</transaction-type><transaction-date iso-date="1990-04-01Z"/></transaction><transaction><value currency="GBP" value-date="2004-03-31Z">24106</value><transaction-type code="D">Disbursement</transaction-type><provider-org ref="GB-1" type="10">Department for International Development</provider-org><description>Aggregated spend data from 01/04/2003 to 31/03/2004</description><transaction-date iso-date="2004-03-31Z"/></transaction><budget type="Original"><period-start iso-date="2003-04-01Z"/><period-end iso-date="2004-03-31Z"/><value value-date="2003-04-01Z" currency="GBP">24106</value></budget><related-activity ref="GB-1-113184" type="1">Eval.&amp; Disseminat'n R &amp; D</related-activity><related-activity ref="GB-1-113184-101" type="3">PROCOFSERVICES and P0113 for Eval.&amp; Disseminat'n R &amp; D</related-activity><legacy-data name="80017 Renewable Natural Resources Research (Global Partnerships)" value="80017" iati-equivalent="sector"/></iati-activity><iati-activity xml:lang="en" default-currency="GBP" hierarchy="1"><reporting-org ref="GB-1" type="10">Department for International Development</reporting-org><participating-org ref="GB" type="10" role="Funding">UNITED KINGDOM</participating-org><participating-org ref="GB-1" type="10" role="Extending">Department for International Development</participating-org><iati-identifier>GB-1-113238</iati-identifier><title>Regional Education Networks</title><description>The Enabling Effective Support (EES) programme, which works in twelve regions of the UK, supports teaching in UK schools on global and international development issues.</description><activity-date type="end-actual">2010-11-01Z</activity-date><activity-date type="end-planned">2010-11-01Z</activity-date><activity-date type="start-actual">2007-07-06Z</activity-date><activity-date type="start-planned">2007-06-01Z</activity-date><activity-status code="4">Post-completion</activity-status><contact-info><organisation>Department for International Development</organisation><telephone>+44 (0) 1355 84 3132</telephone><email>enquiry@dfid.gov.uk</email><mailing-address>Public Enquiry Point, Abercrombie House, Eaglesham Road, East Kilbride, Glasgow G75 8EA</mailing-address></contact-info><default-tied-status code="5">Untied</default-tied-status><related-activity ref="GB-1-113231-105" type="2">Accountable Grant BSFD0009: Enabling Effective Support of the Global Dimension in Scotland - Implementation Strategy Dates (24 Oct 05 30 Sep 09- 575K)</related-activity><related-activity ref="GB-1-113238-101" type="2">All Spend for Effective Enabling Support Before ARIES Was Installed - Feb 2009</related-activity><related-activity ref="GB-1-113238-102" type="2">Accountable Grant BSFD0006: EES: Building Capacity Within the West Midlands Education System (2ND Grant 1 Apr 07 31 Mar '12 800K)</related-activity><related-activity ref="GB-1-113238-103" type="2">Accountable Grant BSFD0007: EES for the Global Dimension in North East Schools (1 Apr 07 31 Mar '12 800K)</related-activity><related-activity ref="GB-1-113238-104" type="2">Accountable Grant BSFD0016: Enabling Effective Support in Northern Ireland 2ND Grant 240830.92 -1St Nov 06 to 31St Oct 2010</related-activity><related-activity ref="GB-1-113238-107" type="2">Accountable Grant BSFD0008: EES for a Global Dimension in Education Yorkshire/Humber Apr 2007 Mar 2012</related-activity><related-activity ref="GB-1-113238-109" type="2">Accountable Grant BSFD0014: Enabling Effective Support: South West Strategy 1St Apr 07 31 Mar 09 754649.95</related-activity><related-activity ref="GB-1-113238-111" type="2">Accountable Grant BSFD0031: East of England Development Education Network (EEDEN): Global Thinking 800K 1 Apr 08-31 Mar 12</related-activity><related-activity ref="GB-1-113238-112" type="2">Accountable Grant BSFD0032: EES: North West Global Education Network 1St Apr 2008 31 Mar 2013 800K</related-activity><related-activity ref="GB-1-113238-113" type="2">Accountable Grant BSFD0034: EES: East Midland Network for Global Perspectives in Schools (EMNGPS) 800K 1St Apr 2008 30 Mar 2013</related-activity><related-activity ref="GB-1-113238-114" type="2">Accountable Grant BSFD0035: Local4Global July 2008- March 2010 605,300</related-activity><related-activity ref="GB-1-113238-115" type="2">BSFD 13 Wales Contract  Apr -Dec 2009</related-activity><related-activity ref="GB-1-113238-126" type="2">EES Wales Sep 2009- Aug 2010</related-activity></iati-activity><iati-activity xml:lang="en" default-currency="GBP" hierarchy="2"><reporting-org ref="GB-1" type="10">Department for International Development</reporting-org><participating-org ref="GB" type="10" role="Funding">UNITED KINGDOM</participating-org><participating-org ref="GB-1" type="10" role="Extending">Department for International Development</participating-org><participating-org ref="22000" role="Implementing">Donor country-based NGO</participating-org><recipient-region>Administrative/Capital (AC)</recipient-region><collaboration-type code="5">Aid through NGOs</collaboration-type><default-flow-type code="10">ODA</default-flow-type><default-aid-type code="H01">Development awareness</default-aid-type><default-finance-type code="110">Aid grant excluding debt reorganisation</default-finance-type><iati-identifier>GB-1-113231-105</iati-identifier><title>Accountable Grant BSFD0009: Enabling Effective Support of the Global Dimension in Scotland - Implementation Strategy Dates (24 Oct 05 30 Sep 09- 575K)</title><sector code="99820">Promotion of development awareness</sector><activity-date type="end-actual">2009-09-30Z</activity-date><activity-date type="end-planned">2009-09-30Z</activity-date><activity-date type="start-actual">2007-06-02Z</activity-date><activity-date type="start-planned">2007-06-02Z</activity-date><activity-status code="4">Post-completion</activity-status><contact-info><organisation>Department for International Development</organisation><telephone>+44 (0) 1355 84 3132</telephone><email>enquiry@dfid.gov.uk</email><mailing-address>Public Enquiry Point, Abercrombie House, Eaglesham Road, East Kilbride, Glasgow G75 8EA</mailing-address></contact-info><default-tied-status code="5">Untied</default-tied-status><policy-marker code="1" vocabulary="DAC" significance="0">Gender Equality</policy-marker><policy-marker code="2" vocabulary="DAC" significance="0">Aid to Environment</policy-marker><policy-marker code="3" vocabulary="DAC" significance="0">Participatory Development/Good Governance</policy-marker><policy-marker code="4" vocabulary="DAC" significance="0">Trade Development</policy-marker><policy-marker code="5" vocabulary="DAC" significance="0">Aid Targeting the Objectives of the Convention on Biological Diversity</policy-marker><policy-marker code="6" vocabulary="DAC" significance="0">Aid Targeting the Objectives of the Framework Convention on Climate Change - Mitigation</policy-marker><policy-marker code="7" vocabulary="DAC" significance="0">Aid Targeting the Objectives of the Framework Convention on Climate Change - Adaptation</policy-marker><policy-marker code="8" vocabulary="DAC" significance="0">Aid Targeting the Objectives of the Convention to Combat Desertification</policy-marker><transaction><value value-date="2009-04-01Z">83051</value><transaction-type code="C">Commitment</transaction-type><transaction-date iso-date="2007-06-02Z">Total Commitment to 30 Sep 2009</transaction-date></transaction><transaction><value currency="GBP" value-date="2010-03-31Z">83051</value><transaction-type code="D">Disbursement</transaction-type><provider-org ref="GB-1" type="10">Department for International Development</provider-org><description>Aggregated spend data from 01/04/2009 to 31/03/2010</description><transaction-date iso-date="2010-03-31Z"/></transaction><budget type="Revised"><period-start iso-date="2009-04-01Z"/><period-end iso-date="2010-03-31Z"/><value value-date="2009-04-01Z" currency="GBP">83051</value></budget><related-activity ref="GB-1-113238" type="1">Regional Education Networks</related-activity><related-activity ref="GB-1-113238-101" type="3">All Spend for Effective Enabling Support Before ARIES Was Installed - Feb 2009</related-activity><related-activity ref="GB-1-113238-102" type="3">Accountable Grant BSFD0006: EES: Building Capacity Within the West Midlands Education System (2ND Grant 1 Apr 07 31 Mar '12 800K)</related-activity><related-activity ref="GB-1-113238-103" type="3">Accountable Grant BSFD0007: EES for the Global Dimension in North East Schools (1 Apr 07 31 Mar '12 800K)</related-activity><related-activity ref="GB-1-113238-104" type="3">Accountable Grant BSFD0016: Enabling Effective Support in Northern Ireland 2ND Grant 240830.92 -1St Nov 06 to 31St Oct 2010</related-activity><related-activity ref="GB-1-113238-107" type="3">Accountable Grant BSFD0008: EES for a Global Dimension in Education Yorkshire/Humber Apr 2007 Mar 2012</related-activity><related-activity ref="GB-1-113238-109" type="3">Accountable Grant BSFD0014: Enabling Effective Support: South West Strategy 1St Apr 07 31 Mar 09 754649.95</related-activity><related-activity ref="GB-1-113238-111" type="3">Accountable Grant BSFD0031: East of England Development Education Network (EEDEN): Global Thinking 800K 1 Apr 08-31 Mar 12</related-activity><related-activity ref="GB-1-113238-112" type="3">Accountable Grant BSFD0032: EES: North West Global Education Network 1St Apr 2008 31 Mar 2013 800K</related-activity><related-activity ref="GB-1-113238-113" type="3">Accountable Grant BSFD0034: EES: East Midland Network for Global Perspectives in Schools (EMNGPS) 800K 1St Apr 2008 30 Mar 2013</related-activity><related-activity ref="GB-1-113238-114" type="3">Accountable Grant BSFD0035: Local4Global July 2008- March 2010 605,300</related-activity><related-activity ref="GB-1-113238-115" type="3">BSFD 13 Wales Contract  Apr -Dec 2009</related-activity><related-activity ref="GB-1-113238-126" type="3">EES Wales Sep 2009- Aug 2010</related-activity><legacy-data name="99820 Promotion of Development Awareness (Global Partnerships)" value="99820" iati-equivalent="sector"/></iati-activity><iati-activity xml:lang="en" default-currency="GBP" hierarchy="1"><reporting-org ref="GB-1" type="10">Department for International Development</reporting-org><participating-org ref="GB" type="10" role="Funding">UNITED KINGDOM</participating-org><participating-org ref="GB-1" type="10" role="Extending">Department for International Development</participating-org><iati-identifier>GB-1-200054</iati-identifier><title>Advance Market Commitments</title><activity-date type="end-actual">2010-09-30Z</activity-date><activity-date type="end-planned">2010-09-30Z</activity-date><activity-date type="start-actual">2008-02-29Z</activity-date><activity-date type="start-planned">2008-02-29Z</activity-date><activity-status code="4">Post-completion</activity-status><contact-info><organisation>Department for International Development</organisation><telephone>+44 (0) 1355 84 3132</telephone><email>enquiry@dfid.gov.uk</email><mailing-address>Public Enquiry Point, Abercrombie House, Eaglesham Road, East Kilbride, Glasgow G75 8EA</mailing-address></contact-info><default-tied-status code="5">Untied</default-tied-status><related-activity ref="GB-1-200054-101" type="2">AMC - Study Costs</related-activity><related-activity ref="GB-1-200054-102" type="2">Advance Market COMMITTMENTS - CONTR to GAVI Fund</related-activity></iati-activity><iati-activity xml:lang="en" default-currency="GBP" hierarchy="2"><reporting-org ref="GB-1" type="10">Department for International Development</reporting-org><participating-org ref="GB" type="10" role="Funding">UNITED KINGDOM</participating-org><participating-org ref="GB-1" type="10" role="Extending">Department for International Development</participating-org><participating-org ref="52000" role="Implementing">Other.</participating-org><recipient-region>Administrative/Capital (AC)</recipient-region><collaboration-type code="1">Bilateral</collaboration-type><default-flow-type code="10">ODA</default-flow-type><default-aid-type code="C01">Project-type interventions</default-aid-type><default-finance-type code="110">Aid grant excluding debt reorganisation</default-finance-type><iati-identifier>GB-1-200054-101</iati-identifier><title>AMC - Study Costs</title><sector code="15110">Public sector policy and administrative management</sector><activity-date type="end-actual">2008-06-01Z</activity-date><activity-date type="end-planned">2008-06-01Z</activity-date><activity-date type="start-actual">2008-02-29Z</activity-date><activity-date type="start-planned">2008-02-29Z</activity-date><activity-status code="4">Post-completion</activity-status><contact-info><organisation>Department for International Development</organisation><telephone>+44 (0) 1355 84 3132</telephone><email>enquiry@dfid.gov.uk</email><mailing-address>Public Enquiry Point, Abercrombie House, Eaglesham Road, East Kilbride, Glasgow G75 8EA</mailing-address></contact-info><default-tied-status code="5">Untied</default-tied-status><policy-marker code="1" vocabulary="DAC" significance="0">Gender Equality</policy-marker><policy-marker code="2" vocabulary="DAC" significance="0">Aid to Environment</policy-marker><policy-marker code="3" vocabulary="DAC" significance="0">Participatory Development/Good Governance</policy-marker><policy-marker code="4" vocabulary="DAC" significance="0">Trade Development</policy-marker><policy-marker code="5" vocabulary="DAC" significance="0">Aid Targeting the Objectives of the Convention on Biological Diversity</policy-marker><policy-marker code="6" vocabulary="DAC" significance="0">Aid Targeting the Objectives of the Framework Convention on Climate Change - Mitigation</policy-marker><policy-marker code="7" vocabulary="DAC" significance="0">Aid Targeting the Objectives of the Framework Convention on Climate Change - Adaptation</policy-marker><policy-marker code="8" vocabulary="DAC" significance="0">Aid Targeting the Objectives of the Convention to Combat Desertification</policy-marker><transaction><value value-date="2008-04-01Z">59934</value><transaction-type code="C">Commitment</transaction-type><transaction-date iso-date="2008-02-29Z">Total Commitment to 01 Jun 2008</transaction-date></transaction><transaction><value currency="GBP" value-date="2008-03-31Z">45368</value><transaction-type code="D">Disbursement</transaction-type><provider-org ref="GB-1" type="10">Department for International Development</provider-org><description>Aggregated spend data from 01/04/2007 to 31/03/2008</description><transaction-date iso-date="2008-03-31Z"/></transaction><transaction><value currency="GBP" value-date="2009-03-31Z">14566</value><transaction-type code="D">Disbursement</transaction-type><provider-org ref="GB-1" type="10">Department for International Development</provider-org><description>Aggregated spend data from 01/04/2008 to 31/03/2009</description><transaction-date iso-date="2009-03-31Z"/></transaction><budget type="Revised"><period-start iso-date="2007-04-01Z"/><period-end iso-date="2008-03-31Z"/><value value-date="2007-04-01Z" currency="GBP">45368</value></budget><budget type="Original"><period-start iso-date="2008-04-01Z"/><period-end iso-date="2009-03-31Z"/><value value-date="2008-04-01Z" currency="GBP">14566</value></budget><related-activity ref="GB-1-200054" type="1">Advance Market Commitments</related-activity><related-activity ref="GB-1-200054-102" type="3">Advance Market COMMITTMENTS - CONTR to GAVI Fund</related-activity><legacy-data name="15110 Economic and Development Policy/Planning: (Governance and Security)" value="15110" iati-equivalent="sector"/></iati-activity><iati-activity xml:lang="en" default-currency="GBP" hierarchy="1"><reporting-org ref="GB-1" type="10">Department for International Development</reporting-org><participating-org ref="GB" type="10" role="Funding">UNITED KINGDOM</participating-org><participating-org ref="GB-1" type="10" role="Extending">Department for International Development</participating-org><iati-identifier>GB-1-200243</iati-identifier><title>Social Development Temp Advisory Cover S</title><activity-date type="end-actual">2009-10-31Z</activity-date><activity-date type="end-planned">2009-10-31Z</activity-date><activity-date type="start-actual">1900-01-01Z</activity-date><activity-date type="start-planned">2008-11-21Z</activity-date><activity-status code="4">Post-completion</activity-status><contact-info><organisation>Department for International Development</organisation><telephone>+44 (0) 1355 84 3132</telephone><email>enquiry@dfid.gov.uk</email><mailing-address>Public Enquiry Point, Abercrombie House, Eaglesham Road, East Kilbride, Glasgow G75 8EA</mailing-address></contact-info><default-tied-status code="5">Untied</default-tied-status><related-activity ref="GB-1-200243-101" type="2">LINA Payne Temporary Cover</related-activity></iati-activity><iati-activity xml:lang="en" default-currency="GBP" hierarchy="2"><reporting-org ref="GB-1" type="10">Department for International Development</reporting-org><participating-org ref="GB" type="10" role="Funding">UNITED KINGDOM</participating-org><participating-org ref="GB-1" type="10" role="Extending">Department for International Development</participating-org><participating-org ref="52000" role="Implementing">Other.</participating-org><recipient-region>Administrative/Capital (AC)</recipient-region><collaboration-type code="1">Bilateral</collaboration-type><default-flow-type code="10">ODA</default-flow-type><default-aid-type code="G01">Administrative costs not included elsewhere</default-aid-type><default-finance-type code="110">Aid grant excluding debt reorganisation</default-finance-type><iati-identifier>GB-1-200243-101</iati-identifier><title>LINA Payne Temporary Cover</title><sector code="91010">Administrative costs</sector><activity-date type="end-actual">2009-10-31Z</activity-date><activity-date type="end-planned">2009-10-31Z</activity-date><activity-date type="start-actual">2008-11-21Z</activity-date><activity-date type="start-planned">2008-11-21Z</activity-date><activity-status code="4">Post-completion</activity-status><contact-info><organisation>Department for International Development</organisation><telephone>+44 (0) 1355 84 3132</telephone><email>enquiry@dfid.gov.uk</email><mailing-address>Public Enquiry Point, Abercrombie House, Eaglesham Road, East Kilbride, Glasgow G75 8EA</mailing-address></contact-info><default-tied-status code="5">Untied</default-tied-status><policy-marker code="1" vocabulary="DAC" significance="0">Gender Equality</policy-marker><policy-marker code="2" vocabulary="DAC" significance="0">Aid to Environment</policy-marker><policy-marker code="3" vocabulary="DAC" significance="0">Participatory Development/Good Governance</policy-marker><policy-marker code="4" vocabulary="DAC" significance="0">Trade Development</policy-marker><policy-marker code="5" vocabulary="DAC" significance="0">Aid Targeting the Objectives of the Convention on Biological Diversity</policy-marker><policy-marker code="6" vocabulary="DAC" significance="0">Aid Targeting the Objectives of the Framework Convention on Climate Change - Mitigation</policy-marker><policy-marker code="7" vocabulary="DAC" significance="0">Aid Targeting the Objectives of the Framework Convention on Climate Change - Adaptation</policy-marker><policy-marker code="8" vocabulary="DAC" significance="0">Aid Targeting the Objectives of the Convention to Combat Desertification</policy-marker><transaction><value value-date="2009-04-01Z">40757</value><transaction-type code="C">Commitment</transaction-type><transaction-date iso-date="2008-11-21Z">Total Commitment to 31 Oct 2009</transaction-date></transaction><transaction><value currency="GBP" value-date="2009-03-31Z">14850</value><transaction-type code="D">Disbursement</transaction-type><provider-org ref="GB-1" type="10">Department for International Development</provider-org><description>Aggregated spend data from 01/04/2008 to 31/03/2009</description><transaction-date iso-date="2009-03-31Z"/></transaction><transaction><value currency="GBP" value-date="2010-03-31Z">22394</value><transaction-type code="D">Disbursement</transaction-type><provider-org ref="GB-1" type="10">Department for International Development</provider-org><description>Aggregated spend data from 01/04/2009 to 31/03/2010</description><transaction-date iso-date="2010-03-31Z"/></transaction><budget type="Revised"><period-start iso-date="2008-04-01Z"/><period-end iso-date="2009-03-31Z"/><value value-date="2008-04-01Z" currency="GBP">17550</value></budget><budget type="Revised"><period-start iso-date="2009-04-01Z"/><period-end iso-date="2010-03-31Z"/><value value-date="2009-04-01Z" currency="GBP">23207</value></budget><related-activity ref="GB-1-200243" type="1">Social Development Temp Advisory Cover S</related-activity><legacy-data name="91010 Administrative Costs of Donors (Admin)" value="91010" iati-equivalent="sector"/></iati-activity><iati-activity xml:lang="en" default-currency="GBP" hierarchy="1"><reporting-org ref="GB-1" type="10">Department for International Development</reporting-org><participating-org ref="GB" type="10" role="Funding">UNITED KINGDOM</participating-org><participating-org ref="GB-1" type="10" role="Extending">Department for International Development</participating-org><iati-identifier>GB-1-200570</iati-identifier><title>ETF-IW Technical Expert to the Board</title><description>To provide expert advice to the ETF-IW Board</description><activity-date type="end-actual">2011-03-31Z</activity-date><activity-date type="end-planned">2011-03-31Z</activity-date><activity-date type="start-actual">2009-04-30Z</activity-date><activity-date type="start-planned">2009-05-01Z</activity-date><activity-status code="2">Implementation</activity-status><contact-info><organisation>Department for International Development</organisation><telephone>+44 (0) 1355 84 3132</telephone><email>enquiry@dfid.gov.uk</email><mailing-address>Public Enquiry Point, Abercrombie House, Eaglesham Road, East Kilbride, Glasgow G75 8EA</mailing-address></contact-info><default-tied-status code="5">Untied</default-tied-status><related-activity ref="GB-1-200570-102" type="2">ETF-IW Technical Expert to the Board</related-activity></iati-activity><iati-activity xml:lang="en" default-currency="GBP" hierarchy="2"><reporting-org ref="GB-1" type="10">Department for International Development</reporting-org><participating-org ref="GB" type="10" role="Funding">UNITED KINGDOM</participating-org><participating-org ref="GB-1" type="10" role="Extending">Department for International Development</participating-org><participating-org ref="51000" role="Implementing">University, college or other teaching institution, research institute or think-tank</participating-org><recipient-region>Administrative/Capital (AC)</recipient-region><collaboration-type code="1">Bilateral</collaboration-type><default-flow-type code="10">ODA</default-flow-type><default-aid-type code="G01">Administrative costs not included elsewhere</default-aid-type><default-finance-type code="110">Aid grant excluding debt reorganisation</default-finance-type><iati-identifier>GB-1-200570-102</iati-identifier><title>ETF-IW Technical Expert to the Board</title><sector code="91010">Administrative costs</sector><activity-date type="end-actual">2011-03-31Z</activity-date><activity-date type="end-planned">2011-03-31Z</activity-date><activity-date type="start-actual">2009-05-01Z</activity-date><activity-date type="start-planned">2009-05-01Z</activity-date><activity-status code="2">Implementation</activity-status><contact-info><organisation>Department for International Development</organisation><telephone>+44 (0) 1355 84 3132</telephone><email>enquiry@dfid.gov.uk</email><mailing-address>Public Enquiry Point, Abercrombie House, Eaglesham Road, East Kilbride, Glasgow G75 8EA</mailing-address></contact-info><default-tied-status code="5">Untied</default-tied-status><policy-marker code="1" vocabulary="DAC" significance="0">Gender Equality</policy-marker><policy-marker code="2" vocabulary="DAC" significance="2">Aid to Environment</policy-marker><policy-marker code="3" vocabulary="DAC" significance="0">Participatory Development/Good Governance</policy-marker><policy-marker code="4" vocabulary="DAC" significance="0">Trade Development</policy-marker><policy-marker code="5" vocabulary="DAC" significance="0">Aid Targeting the Objectives of the Convention on Biological Diversity</policy-marker><policy-marker code="6" vocabulary="DAC" significance="0">Aid Targeting the Objectives of the Framework Convention on Climate Change - Mitigation</policy-marker><policy-marker code="7" vocabulary="DAC" significance="0">Aid Targeting the Objectives of the Framework Convention on Climate Change - Adaptation</policy-marker><policy-marker code="8" vocabulary="DAC" significance="0">Aid Targeting the Objectives of the Convention to Combat Desertification</policy-marker><transaction><value value-date="2010-04-01Z">14000</value><transaction-type code="C">Commitment</transaction-type><transaction-date iso-date="2009-05-01Z">Total Commitment to 31 Mar 2011</transaction-date></transaction><transaction><value currency="GBP" value-date="2010-03-31Z">7000</value><transaction-type code="D">Disbursement</transaction-type><provider-org ref="GB-1" type="10">Department for International Development</provider-org><description>Aggregated spend data from 01/04/2009 to 31/03/2010</description><transaction-date iso-date="2010-03-31Z"/></transaction><transaction><value currency="GBP" value-date="2010-05-11Z">-741</value><transaction-type code="D">Disbursement</transaction-type><provider-org ref="GB-1" type="10">Department for International Development</provider-org><description>Aggregated spend data prior to 12th May 2010.</description><transaction-date iso-date="2010-05-11Z"/></transaction><transaction><value currency="GBP" value-date="2010-07-27Z">600</value><transaction-type code="D">Disbursement</transaction-type><provider-org ref="GB-1" type="10">Department for International Development</provider-org><receiver-org ref="51000">University, college or other teaching institution, research institute or think-tank</receiver-org><description>Technical &amp; Advisory services</description><transaction-date iso-date="2010-07-27Z"/></transaction><transaction><value currency="GBP" value-date="2010-11-11Z">1394</value><transaction-type code="D">Disbursement</transaction-type><provider-org ref="GB-1" type="10">Department for International Development</provider-org><receiver-org ref="51000">University, college or other teaching institution, research institute or think-tank</receiver-org><description>Technical &amp; Advisory services</description><transaction-date iso-date="2010-11-11Z"/></transaction><transaction><value currency="GBP" value-date="2011-02-11Z">1470</value><transaction-type code="D">Disbursement</transaction-type><provider-org ref="GB-1" type="10">Department for International Development</provider-org><receiver-org ref="51000">University, college or other teaching institution, research institute or think-tank</receiver-org><description>Technical &amp; Advisory services</description><transaction-date iso-date="2011-02-11Z"/></transaction><budget type="Revised"><period-start iso-date="2009-04-01Z"/><period-end iso-date="2010-03-31Z"/><value value-date="2009-04-01Z" currency="GBP">7000</value></budget><budget type="Revised"><period-start iso-date="2010-04-01Z"/><period-end iso-date="2011-03-31Z"/><value value-date="2010-04-01Z" currency="GBP">7000</value></budget><related-activity ref="GB-1-200570" type="1">ETF-IW Technical Expert to the Board</related-activity><legacy-data name="91010 Administrative Costs of Donors (Admin)" value="91010" iati-equivalent="sector"/></iati-activity><iati-activity xml:lang="en" default-currency="GBP" hierarchy="1"><reporting-org ref="GB-1" type="10">Department for International Development</reporting-org><participating-org ref="GB" type="10" role="Funding">UNITED KINGDOM</participating-org><participating-org ref="GB-1" type="10" role="Extending">Department for International Development</participating-org><iati-identifier>GB-1-201990</iati-identifier><title>Review of Gender Equality in DFID Centralised Evaluations</title><description>To analyse the level of Gender issues within DFID Evaluations</description><activity-date type="end-actual">2010-10-29Z</activity-date><activity-date type="end-planned">2010-10-29Z</activity-date><activity-date type="start-actual">2010-07-09Z</activity-date><activity-date type="start-planned">2010-07-12Z</activity-date><activity-status code="4">Post-completion</activity-status><contact-info><organisation>Department for International Development</organisation><telephone>+44 (0) 1355 84 3132</telephone><email>enquiry@dfid.gov.uk</email><mailing-address>Public Enquiry Point, Abercrombie House, Eaglesham Road, East Kilbride, Glasgow G75 8EA</mailing-address></contact-info><default-tied-status code="5">Untied</default-tied-status><related-activity ref="GB-1-201990-101" type="2">Review of Gender Equality in EVDS Evaluations</related-activity></iati-activity><iati-activity xml:lang="en" default-currency="GBP" hierarchy="2"><reporting-org ref="GB-1" type="10">Department for International Development</reporting-org><participating-org ref="GB" type="10" role="Funding">UNITED KINGDOM</participating-org><participating-org ref="GB-1" type="10" role="Extending">Department for International Development</participating-org><participating-org ref="52000" role="Implementing">Other.</participating-org><recipient-region>Administrative/Capital (AC)</recipient-region><collaboration-type code="1">Bilateral</collaboration-type><default-flow-type code="10">ODA</default-flow-type><default-aid-type code="G01">Administrative costs not included elsewhere</default-aid-type><default-finance-type code="110">Aid grant excluding debt reorganisation</default-finance-type><iati-identifier>GB-1-201990-101</iati-identifier><title>Review of Gender Equality in EVDS Evaluations</title><sector code="91010">Administrative costs</sector><activity-date type="end-actual">2010-10-29Z</activity-date><activity-date type="end-planned">2010-10-29Z</activity-date><activity-date type="start-actual">2010-07-12Z</activity-date><activity-date type="start-planned">2010-07-12Z</activity-date><activity-status code="4">Post-completion</activity-status><contact-info><organisation>Department for International Development</organisation><telephone>+44 (0) 1355 84 3132</telephone><email>enquiry@dfid.gov.uk</email><mailing-address>Public Enquiry Point, Abercrombie House, Eaglesham Road, East Kilbride, Glasgow G75 8EA</mailing-address></contact-info><default-tied-status code="5">Untied</default-tied-status><policy-marker code="1" vocabulary="DAC" significance="2">Gender Equality</policy-marker><policy-marker code="2" vocabulary="DAC" significance="0">Aid to Environment</policy-marker><policy-marker code="3" vocabulary="DAC" significance="0">Participatory Development/Good Governance</policy-marker><policy-marker code="4" vocabulary="DAC" significance="0">Trade Development</policy-marker><policy-marker code="5" vocabulary="DAC" significance="0">Aid Targeting the Objectives of the Convention on Biological Diversity</policy-marker><policy-marker code="6" vocabulary="DAC" significance="0">Aid Targeting the Objectives of the Framework Convention on Climate Change - Mitigation</policy-marker><policy-marker code="7" vocabulary="DAC" significance="0">Aid Targeting the Objectives of the Framework Convention on Climate Change - Adaptation</policy-marker><policy-marker code="8" vocabulary="DAC" significance="0">Aid Targeting the Objectives of the Convention to Combat Desertification</policy-marker><transaction><value value-date="2011-04-01Z">1350</value><transaction-type code="C">Commitment</transaction-type><transaction-date iso-date="2010-07-12Z">Total Commitment to 29 Oct 2010</transaction-date></transaction><transaction><value currency="GBP" value-date="2010-07-23Z">1350</value><transaction-type code="D">Disbursement</transaction-type><provider-org ref="GB-1" type="10">Department for International Development</provider-org><receiver-org ref="52000">Other.</receiver-org><description>Technical &amp; Advisory services</description><transaction-date iso-date="2010-07-23Z"/></transaction><budget type="Revised"><period-start iso-date="2010-04-01Z"/><period-end iso-date="2011-03-31Z"/><value value-date="2010-04-01Z" currency="GBP">1350</value></budget><related-activity ref="GB-1-201990" type="1">Review of Gender Equality in DFID Centralised Evaluations</related-activity><legacy-data name="91010 Administrative Costs of Donors (Admin)" value="91010" iati-equivalent="sector"/></iati-activity></iati-activities>